{
  "schema_version": "fsd-report/1",
  "doc": {
    "doc_id": "ISC001",
    "title": "采购申请点检审批功能",
    "project": "XXX项目",
    "author_org": "XXX实施公司名称",
    "version": "V1.3",
    "change_log": [
      {
        "version": "V1.0",
        "date": "2025-06-25",
        "content": "创建"
      },
      {
        "version": "V1.1",
        "date": "2026-10-10",
        "content": "修正审批代码判定、审批粒度及字段来源；补充功能按钮、逐行处理结果、提交与回滚、消息与异常处理"
      },
      {
        "version": "V1.2",
        "date": "2026-10-10",
        "content": "MRP 来源增加创建标识条件；审批改为按权限连续多级审批；已部分审批的采购申请修改时先取消审批、保存后恢复审批；库存取数恢复原逻辑"
      },
      {
        "version": "V1.3",
        "date": "2026-10-10",
        "content": "函数与 BAPI 只保留名称，不再列出参数"
      }
    ]
  },
  "target": {
    "product": "S4_OP",
    "release": "S4CORE 105",
    "basis_release": "SAP_BASIS 755",
    "source": "SYSTEM"
  },
  "overview": {
    "summary": "ISC001_采购申请点检审批功能",
    "difficulty": "中",
    "tcode": "ZISC001",
    "run_type": "在线处理",
    "output_to": "ALV（可编辑）",
    "volume": "按工厂查询；单次结果为所选工厂范围内的待审批采购申请行项目",
    "remark": "本功能包含采购申请修改与审批两类写操作"
  },
  "requirement": {
    "background": "在现行采购申请（Purchase Requisition，以下简称\"采购申请\"）处理流程中，MRP 运行自动生成的采购申请在生效前须经人工审批。当前审批动作分散于多个事务之间，采购人员需在不同界面间切换方可完成\"查询—核对—修改—审批\"的完整操作，缺乏统一的工作台，既降低了处理效率，也容易因操作路径分散而产生漏单或错单风险。",
    "goals": [
      "以采购申请行项目为粒度，集中展示待审批清单，便于逐条点检；",
      "支持在审批前对采购申请的需求日期、数量进行修正，数量改为 0 即标记删除该行，避免错误的申请进入后续采购流程；",
      "提供工厂库存、工厂可用库存等参考信息，辅助采购人员在点检时做出判断；",
      "批量保存与批量审批时逐行反馈处理结果，单行失败不影响其他行的处理。"
    ],
    "roles": [
      {
        "role": "采购人员（关键用户）",
        "scenario": "定期巡检 MRP 生成的未审批采购申请，核对并修正需求，完成审批放行"
      }
    ],
    "scope_in": [
      "未审批采购申请的查询、点检（需求日期、数量修正及行项目标记删除）、审批、库存参考、界面跳转。"
    ],
    "scope_out": [
      "采购申请的新建、物料主数据的维护、单独的取消审批操作（仅在修改已部分审批的采购申请时由程序内部执行，见 [[LOG-SAVE]]）、供应商选择等后续采购流程动作。"
    ],
    "constraints": [
      "仅处理由 MRP 运行生成、且采购申请类型为 ZR10 的采购申请。",
      "仅处理尚未完成审批、未删除、未关闭的采购申请（判定条件见 [[LOG-QUERY]]、[[LOG-RELEASE-STATUS]]）。",
      "审批代码不在程序中固定，按每张采购申请的审批策略及当前审批进度确定（见 [[LOG-RELEASE-STATUS]]）。"
    ],
    "basis": {
      "kind": "CUSTOMER_DECISION",
      "refs": ["requirement"]
    }
  },
  "authorizations": {
    "intro": "本功能在以下时点进行权限校验。权限对象及授权由系统管理员在角色维护中分配，程序仅负责校验。",
    "items": [
      {
        "id": "AUTH-WRK-DISPLAY",
        "timing": "执行查询时",
        "auth_object": "M_BANF_WRK",
        "auth_object_text": "采购申请工厂权限",
        "fields": "ACTVT = 03（显示）、WERKS",
        "value_source": "选择屏幕\"工厂\"范围内的每个工厂"
      },
      {
        "id": "AUTH-WRK-CHANGE",
        "timing": "保存修改前（按采购申请行逐行校验）",
        "auth_object": "M_BANF_WRK",
        "auth_object_text": "采购申请工厂权限",
        "fields": "ACTVT = 02（修改）、WERKS",
        "value_source": "该行的工厂 EBAN-WERKS"
      },
      {
        "id": "AUTH-REL-APPROVE",
        "timing": "审批前（按处理对象、逐级校验）",
        "auth_object": "M_EINK_FRG",
        "auth_object_text": "采购申请审批权限",
        "fields": "FRGGR、FRGCO",
        "value_source": "该采购申请的审批组 EBAN-FRGGR，及按 [[LOG-RELEASE-STATUS]] 确定的每一级待审批代码"
      },
      {
        "id": "AUTH-REL-RESET",
        "timing": "保存已部分审批的采购申请前（逐级校验）",
        "auth_object": "M_EINK_FRG",
        "auth_object_text": "采购申请审批权限",
        "fields": "FRGGR、FRGCO",
        "value_source": "该采购申请的审批组 EBAN-FRGGR，及每一个已审批的审批代码（见 [[LOG-SAVE]]）"
      }
    ],
    "notes": [
      {
        "id": "AN-QUERY",
        "title": "查询时的工厂权限",
        "body": "\"工厂\"为必填的范围条件。程序取该范围在工厂主数据（T001W）中匹配到的全部工厂逐一校验显示权限：\n   - 全部工厂均无权限时，提示权限不足并终止查询；\n   - 部分工厂无权限时，仅查询有权限的工厂，并提示被排除的工厂。"
      },
      {
        "id": "AN-SAVE",
        "title": "保存时的工厂权限",
        "body": "对有修改的行逐行校验修改权限；无权限的行不保存，该行结果记为失败，其他行继续处理。"
      },
      {
        "id": "AN-APPROVE",
        "title": "审批权限",
        "body": "对每个处理对象逐级校验待审批代码；用户只审批其有权限的连续各级，第一级即无权限时结果记为失败，其他对象继续处理。审批代码的确定方法见 [[LOG-RELEASE-STATUS]]。"
      },
      {
        "id": "AN-RESET",
        "title": "取消审批权限",
        "body": "修改已部分审批的采购申请时，须对其每一个已审批代码均有审批权限，否则该采购申请不能修改，结果记为失败（见 [[LOG-SAVE]]）。"
      },
      {
        "id": "AN-MESSAGES",
        "body": "各类校验失败的消息类型与提示文本见 [[SEC-MESSAGES]]。"
      }
    ]
  },
  "selection_screen": {
    "intro": "选择屏幕用于录入采购申请点检的筛选条件，程序据此查询符合条件的待审批采购申请清单。",
    "fields": [
      {
        "id": "SEL-WERKS",
        "label": "工厂",
        "kind": "S",
        "ref": "EBAN-WERKS",
        "required": true,
        "description": "工厂"
      },
      {
        "id": "SEL-LGORT",
        "label": "库存地点",
        "kind": "S",
        "ref": "EBAN-LGORT",
        "required": false,
        "description": "库存地点"
      },
      {
        "id": "SEL-DISPO",
        "label": "MRP 控制者",
        "kind": "S",
        "ref": "EBAN-DISPO",
        "required": false,
        "description": "MRP 控制者"
      },
      {
        "id": "SEL-BANFN",
        "label": "采购申请",
        "kind": "S",
        "ref": "EBAN-BANFN",
        "required": false,
        "description": "采购申请编号"
      },
      {
        "id": "SEL-MATNR",
        "label": "物料",
        "kind": "S",
        "ref": "EBAN-MATNR",
        "required": false,
        "description": "物料编号"
      },
      {
        "id": "SEL-MATKL",
        "label": "物料组",
        "kind": "S",
        "ref": "EBAN-MATKL",
        "required": false,
        "description": "物料组"
      },
      {
        "id": "SEL-EKGRP",
        "label": "采购组",
        "kind": "S",
        "ref": "EBAN-EKGRP",
        "required": false,
        "description": "采购组"
      },
      {
        "id": "SEL-BADAT",
        "label": "创建日期",
        "kind": "S",
        "ref": "EBAN-BADAT",
        "required": false,
        "description": "采购申请创建日期"
      },
      {
        "id": "SEL-LFDAT",
        "label": "需求日期",
        "kind": "S",
        "ref": "EBAN-LFDAT",
        "required": false,
        "description": "采购申请需求日期（交货日期）"
      }
    ],
    "note": "注：P 代表 PARAMETERS，输入为单值；S 代表 SELECT-OPTIONS，输入为一个范围。可选条件未录入时表示不限制。"
  },
  "selection_checks": {
    "intro": "程序在执行查询前对用户录入内容执行以下检查：",
    "items": [
      {
        "id": "CHK-REQUIRED",
        "title": "必填校验",
        "body": "工厂（EBAN-WERKS）未录入时提示\"请录入工厂\"，阻止执行。"
      },
      {
        "id": "CHK-AUTH",
        "title": "工厂权限校验",
        "body": "按 [[SEC-AUTH]] 对工厂范围执行显示权限校验。"
      },
      {
        "id": "CHK-EMPTY",
        "title": "结果提示",
        "body": "查询结果为空时提示\"没有查到符合条件的采购申请\"，避免用户误判为系统异常。"
      }
    ]
  },
  "output": {
    "intro": "查询结果以采购申请行项目为粒度（一行代表一个采购申请行项目），通过可编辑 ALV 展示，默认按工厂、采购申请编号、行项目号升序排列。数据类型与长度沿用参照字段的数据元素。",
    "fields": [
      {
        "id": "OUT-RESULT",
        "name": "处理结果",
        "ref": "—",
        "description": "最近一次保存或审批的结果指示灯：绿灯成功、红灯失败；未处理时为空",
        "handling": "显示"
      },
      {
        "id": "OUT-MESSAGE",
        "name": "处理消息",
        "ref": "—",
        "description": "最近一次保存或审批的结果说明，失败时为失败原因",
        "handling": "显示"
      },
      {
        "id": "OUT-BANFN",
        "name": "BANFN",
        "ref": "EBAN-BANFN",
        "description": "采购申请编号",
        "handling": "显示"
      },
      {
        "id": "OUT-BNFPO",
        "name": "BNFPO",
        "ref": "EBAN-BNFPO",
        "description": "采购申请行项目号",
        "handling": "显示"
      },
      {
        "id": "OUT-MATNR",
        "name": "MATNR",
        "ref": "EBAN-MATNR",
        "description": "物料编号",
        "handling": "显示"
      },
      {
        "id": "OUT-MAKTX",
        "name": "MAKTX",
        "ref": "MAKT-MAKTX",
        "description": "物料描述",
        "handling": "显示"
      },
      {
        "id": "OUT-LFDAT",
        "name": "LFDAT",
        "ref": "EBAN-LFDAT",
        "description": "需求日期",
        "handling": "可修改"
      },
      {
        "id": "OUT-MENGE",
        "name": "MENGE",
        "ref": "EBAN-MENGE",
        "description": "需求数量",
        "handling": "可修改"
      },
      {
        "id": "OUT-MEINS",
        "name": "MEINS",
        "ref": "EBAN-MEINS",
        "description": "计量单位",
        "handling": "显示"
      },
      {
        "id": "OUT-STOCK",
        "name": "STOCK",
        "ref": "MD_STOCK_REQUIREMENTS_LIST_API 返回",
        "description": "工厂库存（见 [[LOG-STOCK]]）",
        "handling": "显示"
      },
      {
        "id": "OUT-AVAIL",
        "name": "AVAIL",
        "ref": "MD_STOCK_REQUIREMENTS_LIST_API 返回",
        "description": "工厂可用库存（见 [[LOG-STOCK]]）",
        "handling": "显示"
      },
      {
        "id": "OUT-PLIFZ",
        "name": "PLIFZ",
        "ref": "EBAN-PLIFZ",
        "description": "计划交货时间（天）",
        "handling": "显示"
      },
      {
        "id": "OUT-BADAT",
        "name": "BADAT",
        "ref": "EBAN-BADAT",
        "description": "创建日期",
        "handling": "显示"
      },
      {
        "id": "OUT-FRGDT",
        "name": "FRGDT",
        "ref": "EBAN-FRGDT",
        "description": "审批日期（建议下单日期）",
        "handling": "显示"
      },
      {
        "id": "OUT-FRGGR",
        "name": "FRGGR",
        "ref": "EBAN-FRGGR",
        "description": "审批组",
        "handling": "显示"
      },
      {
        "id": "OUT-FRGST",
        "name": "FRGST",
        "ref": "EBAN-FRGST",
        "description": "审批策略",
        "handling": "显示"
      },
      {
        "id": "OUT-FRGZU",
        "name": "FRGZU",
        "ref": "EBAN-FRGZU",
        "description": "审批状态（已审批的级次）",
        "handling": "显示"
      },
      {
        "id": "OUT-FRGCO",
        "name": "FRGCO",
        "ref": "按 [[LOG-RELEASE-STATUS]] 确定",
        "description": "当前待审批代码",
        "handling": "显示"
      },
      {
        "id": "OUT-DISPO",
        "name": "DISPO",
        "ref": "EBAN-DISPO",
        "description": "MRP 控制者",
        "handling": "显示"
      },
      {
        "id": "OUT-WERKS",
        "name": "WERKS",
        "ref": "EBAN-WERKS",
        "description": "工厂",
        "handling": "显示"
      },
      {
        "id": "OUT-NAME1",
        "name": "NAME1",
        "ref": "T001W-NAME1",
        "description": "工厂名称",
        "handling": "显示"
      },
      {
        "id": "OUT-MATKL",
        "name": "MATKL",
        "ref": "EBAN-MATKL",
        "description": "物料组",